{
  "schema_version": 1,
  "id": "douglas-a26-c",
  "display_name": "A-26C Invader",
  "manufacturer": "Douglas Aircraft",
  "model": "A-26",
  "variant": "C",
  "category": "BOMBER",
  "wingspan_ft": 70.0,
  "length_ft": 50.9,
  "tail_height_ft": 18.6,
  "prop_arc_ft": 12.8,
  "default_display_type": "WARBIRD_HERITAGE",
  "silhouette_svg": "douglas-a26-c.svg",
  "data_sources": [
    "USAAF T.O. 01-40AJ-1 Pilot's Flight Operating Instructions A-26C",
    "Jane's All the World's Aircraft 1945–46",
    "Douglas A-26 Invader, Scott Libis, Specialty Press, 1999"
  ]
}
